{
  "profile_version": "1.0.0",
  "scenario_id": "SPEC-GOLDEN-SPECIMEN-E2E-001",
  "critical_exact_paths": [
    "$.specimen.specimen_id",
    "$.specimen.tenant_id",
    "$.specimen.status",
    "$.specimen.revision",
    "$.specimen.result.unit",
    "$.specimen.result.quality_flag",
    "$.migration.semantic_parity",
    "$.restore.clean_environment",
    "$.security.tenant_boundary"
  ],
  "declared_nondeterminism": [
    "$.execution.completed_at",
    "$.execution.trace_id"
  ],
  "numeric_tolerances": {
    "$.restore.observed_recovery_seconds": {
      "absolute": 30,
      "relative": 0.25
    },
    "$.telemetry.vendor_projection_readback": {
      "absolute": 0.001,
      "relative": 0
    }
  },
  "reportable_paths": [
    "$.operations.manual_steps",
    "$.restore.observed_recovery_seconds"
  ],
  "adjudications": {
    "$.restore.observed_recovery_seconds": {
      "classification": "desired_divergence",
      "rationale": "Observed recovery is faster than the conservative forecast and remains within the approved objective."
    },
    "$.operations.manual_steps": {
      "classification": "actual_gap",
      "rationale": "Observed operation requires an additional manual handoff; the team will assess automation and accountable control value."
    }
  }
}
